{
  "metadata": {
    "schema_version": "2.0",
    "content_version": "1.0",
    "revision": 1,
    "generated_by": {
      "type": "ai",
      "provider": "deepseek",
      "model": "deepseek-chat"
    }
  },
  "episode_id": "travel_new_york_city_ep001",
  "scene_id": "S005",
  "target_language": "en",
  "cefr_level": "A2",
  "source_dialogue": {
    "source_scene_id": "S005",
    "source_line_ids": [
      "L001",
      "L002",
      "L003",
      "L004"
    ]
  },
  "key_expressions": [
    {
      "key_expression_id": "KE001",
      "source_line_ids": [
        "L001"
      ],
      "expression": "Can you tell me where to go for ground transportation?",
      "meaning": "지상 교통수단을 이용하려면 어디로 가야 하는지 알려줄 수 있나요?",
      "usage": "공항이나 큰 역에서 목적지를 찾을 때 직원이나 현지인에게 정중하게 길을 물어볼 때 사용한다. 'Can you tell me...'는 상대방에게 부담을 주지 않으면서 정보를 요청하는 공손한 표현이다.",
      "context": "지은이 수하물을 찾은 후 맨해튼으로 가는 지상 교통수단을 이용하기 위해 공항 직원에게 어디로 가야 하는지 묻는 상황이다.",
      "communicative_function": "asking for directions",
      "difficulty": "A2",
      "priority": "core",
      "variation": "Could you tell me where to go for ground transportation?",
      "common_mistake": null,
      "review": {
        "should_review": false,
        "review_reason": null
      }
    },
    {
      "key_expression_id": "KE002",
      "source_line_ids": [
        "L002"
      ],
      "expression": "Just follow the signs for Ground Transportation.",
      "meaning": "지상 교통수단 안내 표지판을 따라가시면 됩니다.",
      "usage": "상대방에게 길을 안내할 때 '~ 표지판을 따라가다'라는 표현으로, 공항, 역, 길거리 등에서 특정 장소를 찾을 때 유용하다. 'Just'를 붙이면 '그냥 ~만 하면 된다'는 가벼운 안내의 느낌을 준다.",
      "context": "공항 직원이 지은이에게 지상 교통수단 구역으로 가는 방법을 안내하며 표지판을 따라가라고 말하는 상황이다.",
      "communicative_function": "giving directions",
      "difficulty": "A2",
      "priority": "core",
      "variation": "Just follow the signs for the exit.",
      "common_mistake": null,
      "review": {
        "should_review": false,
        "review_reason": null
      }
    },
    {
      "key_expression_id": "KE003",
      "source_line_ids": [
        "L003"
      ],
      "expression": "Is it far from here?",
      "meaning": "여기에서 먼가요?",
      "usage": "어떤 장소까지의 거리가 가까운지 먼지 궁금할 때 사용하는 기본적인 질문 표현이다. 길을 안내받은 후 거리를 확인할 때 자연스럽게 쓸 수 있다.",
      "context": "지은이가 공항 직원에게 지상 교통수단 구역까지의 거리를 확인하기 위해 묻는 상황이다.",
      "communicative_function": "asking about distance",
      "difficulty": "A1",
      "priority": "useful",
      "variation": "How far is it from here?",
      "common_mistake": null,
      "review": {
        "should_review": false,
        "review_reason": null
      }
    },
    {
      "key_expression_id": "KE004",
      "source_line_ids": [
        "L004"
      ],
      "expression": "It's just a short walk.",
      "meaning": "걸어서 금방이에요. / 조금만 걸으면 돼요.",
      "usage": "어떤 장소가 가까워서 걸어서 갈 수 있을 때 상대방에게 안심시키며 거리를 설명하는 표현이다. 'just'를 사용해 '정말 가깝다'는 부담 없는 느낌을 전달한다.",
      "context": "공항 직원이 지은이에게 지상 교통수단 구역이 가깝다고 안심시키며 짧은 거리임을 설명하는 상황이다.",
      "communicative_function": "reassuring",
      "difficulty": "A2",
      "priority": "useful",
      "variation": "It's not far at all.",
      "common_mistake": null,
      "review": {
        "should_review": false,
        "review_reason": null
      }
    }
  ],
  "validation": {
    "expression_count": 4,
    "all_expressions_exist_in_dialogue": true,
    "source_lines_valid": true,
    "cefr_appropriate": true
  }
}
